{
  "schema_version": "1.0",
  "brand_id": "calapres",
  "account_id": 179973,
  "inbox_id": 128326,
  "channel": "email",
  "conversation_id": "700326",
  "anchor_message_id": "900326",
  "conversation_fingerprint": "1111111111111111111111111111111111111111111111111111111111111111",
  "message_fingerprint": "2222222222222222222222222222222222222222222222222222222222222222",
  "correlation_id": "calapres:synthetic:delay:live-email-001",
  "event_identity_key_version": "calapres-identity-hmac-v1",
  "event_identity_fingerprint": "8888888888888888888888888888888888888888888888888888888888888888",
  "generation": 1,
  "wait_state_fingerprint": "17839e5e72c717db36eea3e85a3f0d23bb70dc7310731c546078280fca6867d0",
  "baseline_fingerprint_key_version": "calapres-hmac-v1",
  "baseline_status_fingerprint": "4444444444444444444444444444444444444444444444444444444444444444",
  "baseline_assignee_fingerprint": "5555555555555555555555555555555555555555555555555555555555555555",
  "delay_policy_version": "2026-08-11-v1",
  "delay_mode": "live_observation",
  "delay_seconds": 180,
  "not_before": "2026-08-11T12:07:00+03:00",
  "knowledge_version": "2026-08-11-v3",
  "fixture_ref": null,
  "customer_egress_allowed": false
}
