{
  "schema_version": "1.0",
  "brand_id": "calapres",
  "account_id": 179973,
  "inbox_id": 128058,
  "channel": "whatsapp",
  "conversation_id": "700058",
  "anchor_message_id": "900058",
  "conversation_fingerprint": "1111111111111111111111111111111111111111111111111111111111111111",
  "message_fingerprint": "2222222222222222222222222222222222222222222222222222222222222222",
  "correlation_id": "calapres:synthetic:delay:live-wa-001",
  "event_identity_key_version": "calapres-identity-hmac-v1",
  "event_identity_fingerprint": "8888888888888888888888888888888888888888888888888888888888888888",
  "generation": 1,
  "wait_state_fingerprint": "85cfaf542b3592971e9f8a5ba28453fd15e091f803e44b69fb9fd352cdfc66de",
  "baseline_fingerprint_key_version": "calapres-hmac-v1",
  "baseline_status_fingerprint": "4444444444444444444444444444444444444444444444444444444444444444",
  "baseline_assignee_fingerprint": "5555555555555555555555555555555555555555555555555555555555555555",
  "delay_policy_version": "2026-08-11-v1",
  "delay_mode": "live_observation",
  "delay_seconds": 45,
  "not_before": "2026-08-11T12:04:45+03:00",
  "knowledge_version": "2026-08-11-v3",
  "fixture_ref": null,
  "customer_egress_allowed": false
}
